{
  "$schema": "../../../../../packages/psy_content/schema/manifest.schema.json",
  "kind": "manifest",
  "schemaVersion": 2,
  "contentVersion": 4,
  "updatedAt": "2026-09-11",
  "modules": ["psy0"],
  "changelog": [
    { "contentVersion": 4, "date": "2026-09-11", "summary": "Contract v2: 14 PSY0 activity families, psy0_full / psy0_short blueprints with cadence and scoring policy." },
    { "contentVersion": 3, "date": "2026-09-11", "summary": "Fix correct answer of english.reading.0042 (version 2); add lesson arithmetic_grid.lesson.03." },
    { "contentVersion": 2, "date": "2026-09-04", "summary": "English bank: +120 reading items." },
    { "contentVersion": 1, "date": "2026-08-28", "summary": "Initial PSY0 bundle." }
  ]
}
